Sale?,URL,Name,Current Price,Shipping,Page URL
SALE,"<a class=""item-title"" href=""https://www.newegg.com/p/N82E16824569006?Item=N82E16824569006&amp;Description=1080p monitor 27 inch&amp;cm_re=1080p_monitor 27 inch-_-24-569-006-_-Product"" title=""View Details"">Westinghouse WM27PX9019 27"" Full HD 1920 x 1080 144Hz HDMI VGA DisplayPort AMD FreeSync Technology Flicker-Free Edgeless Design Eye Care Technology Widescreen Backlit LED Gaming Monitor</a>","Westinghouse WM27PX9019 27"" Full HD 1920 x 1080 144Hz HDMI VGA DisplayPort AMD FreeSync Technology Flicker-Free Edgeless Design Eye Care Technology Widescreen Backlit LED Gaming Monitor",$169.99,Free Shipping,https://www.newegg.com/p/pl?d=1080p+monitor+27+inch&N=4814&page=1
SALE,"<a class=""item-title"" href=""https://www.newegg.com/westinghouse-wh27fx9019-27-full-hd/p/N82E16824569002?Item=N82E16824569002&amp;Description=1080p monitor 27 inch&amp;cm_re=1080p_monitor 27 inch-_-24-569-002-_-Product"" title=""View Details"">Westinghouse WH27FX9019 27"" Full HD 1920 x 1080 HDMI VGA Flicker-Free Technology Low Blue Light Filter Zero Bezel Frame Widescreen Backlit LED IPS Monitor</a>","Westinghouse WH27FX9019 27"" Full HD 1920 x 1080 HDMI VGA Flicker-Free Technology Low Blue Light Filter Zero Bezel Frame Widescreen Backlit LED IPS Monitor",$129.99,Free Shipping,https://www.newegg.com/p/pl?d=1080p+monitor+27+inch&N=4814&page=1
,"<a class=""link-blue"" href=""https://www.newegg.com/sellers/index.php/marketing-sponsored-product-ads/"">learn more</a>","Z-EDGE UG27 27"" 1080P Full HD 1920x1080 1ms (MPRT) 165Hz Refresh Rate 1500R Curved Gaming Monitor, FreeSync, HDR, Ultra-Slim Bezel, DisplayPort x2, HDMI x2",$239.99,Free Shipping,https://www.newegg.com/p/pl?d=1080p+monitor+27+inch&N=4814&page=1
,"<a class=""link-blue"" href=""https://www.newegg.com/sellers/index.php/marketing-sponsored-product-ads/"">learn more</a>","Z-EDGE UG32 32"" SVA 1080P Full HD1920x1080 165Hz MPRT 1ms 1500R Curved Gaming Monitor, HDMI x2+DP x2, 178° View Angle, Built in Speakers, Eye-Care Technology",$289.99,Free Shipping,https://www.newegg.com/p/pl?d=1080p+monitor+27+inch&N=4814&page=1
,"<a class=""link-blue"" href=""https://www.newegg.com/sellers/index.php/marketing-sponsored-product-ads/"">learn more</a>","Z-EDGE U27I 27"" Frameless Full HD 1080P 1920x1080 IPS Screen LED Backlight Monitor, with 75Hz refresh rate and Eye-Care technology, 178° wide view angle, Built-in speakers, VGA+HDMI",$149.99,Free Shipping,https://www.newegg.com/p/pl?d=1080p+monitor+27+inch&N=4814&page=1
,"<a class=""link-blue"" href=""https://www.newegg.com/sellers/index.php/marketing-sponsored-product-ads/"">learn more</a>","Z-EDGE U24C 24"" 1080P 1920x1080 Full HD 5ms (MPRT) VGA+HDMI LED Backlit 2800R Curved Monitor, with Eye-Care Technology, Built-in Speakers",$139.99,Free Shipping,https://www.newegg.com/p/pl?d=1080p+monitor+27+inch&N=4814&page=1
SALE,"<a class=""item-title"" href=""https://www.newegg.com/p/N82E16824012014?Item=N82E16824012014&amp;Description=1080p monitor 27 inch&amp;cm_re=1080p_monitor 27 inch-_-24-012-014-_-Product"" title=""View Details"">GIGABYTE G27FC 27"" 165Hz 1080P Curved Gaming Monitor, 1920 x 1080 VA 1500R Display, 1ms (MPRT) Response Time, 90% DCI-P3, FreeSync Premium, 1x Display Port 1.2, 2x HDMI 1.4, 2x USB 3.0</a>","GIGABYTE G27FC 27"" 165Hz 1080P Curved Gaming Monitor, 1920 x 1080 VA 1500R Display, 1ms (MPRT) Response Time, 90% DCI-P3, FreeSync Premium, 1x Display Port 1.2, 2x HDMI 1.4, 2x USB 3.0",$229.99,Free Shipping,https://www.newegg.com/p/pl?d=1080p+monitor+27+inch&N=4814&page=1
SALE,"<a class=""item-title"" href=""https://www.newegg.com/p/N82E16824116985?Item=N82E16824116985&amp;Description=1080p monitor 27 inch&amp;cm_re=1080p_monitor 27 inch-_-24-116-985-_-Product"" title=""View Details"">ViewSonic XG2705 27"" Full HD 1920 x 1080 1ms (GTG) 144 Hz HDMI, DisplayPort AMD FreeSync Technology Built-in Speakers Gaming Monitor</a>","ViewSonic XG2705 27"" Full HD 1920 x 1080 1ms (GTG) 144 Hz HDMI, DisplayPort AMD FreeSync Technology Built-in Speakers Gaming Monitor",$204.99,Free Shipping,https://www.newegg.com/p/pl?d=1080p+monitor+27+inch&N=4814&page=1
SALE,"<a class=""item-title"" href=""https://www.newegg.com/p/N82E16824012016?Item=N82E16824012016&amp;Description=1080p monitor 27 inch&amp;cm_re=1080p_monitor 27 inch-_-24-012-016-_-Product"" title=""View Details"">GIGABYTE G27F 27"" 144Hz 1080P Gaming Monitor, 1920 x 1080 IPS Display, 1ms (MPRT) Response Time, 95% DCI-P3, FreeSync Premium, 1x Display Port 1.2, 2x HDMI 1.4, 2x USB 3.0</a>","GIGABYTE G27F 27"" 144Hz 1080P Gaming Monitor, 1920 x 1080 IPS Display, 1ms (MPRT) Response Time, 95% DCI-P3, FreeSync Premium, 1x Display Port 1.2, 2x HDMI 1.4, 2x USB 3.0",$229.99,Free Shipping,https://www.newegg.com/p/pl?d=1080p+monitor+27+inch&N=4814&page=1
SALE,"<a class=""item-title"" href=""https://www.newegg.com/p/N82E16824116781?Item=N82E16824116781&amp;Description=1080p monitor 27 inch&amp;cm_re=1080p_monitor 27 inch-_-24-116-781-_-Product"" title=""View Details"">ViewSonic VX2757-MHD 27"" Full HD 1920 x 1080 2ms 75Hz HDMI VGA DisplayPort AMD FreeSync Built-in Speakers Anti-Glare Backlit LED Gaming Monitor</a>","ViewSonic VX2757-MHD 27"" Full HD 1920 x 1080 2ms 75Hz HDMI VGA DisplayPort AMD FreeSync Built-in Speakers Anti-Glare Backlit LED Gaming Monitor",$164.99,Free Shipping,https://www.newegg.com/p/pl?d=1080p+monitor+27+inch&N=4814&page=1
,"<a class=""item-title"" href=""https://www.newegg.com/p/N82E16824236994?Item=N82E16824236994&amp;Description=1080p monitor 27 inch&amp;cm_re=1080p_monitor 27 inch-_-24-236-994-_-Product"" title=""View Details"">ASUS VG278QR 27"" Full HD 1920 x 1080 165Hz 0.5ms DisplayPort HDMI DVI-D G-SYNC Compatible Asus Eye Care Flciker-Free Technology Low Blue Light Built-in Speakers Backlit LED Gaming Monitor</a>","ASUS VG278QR 27"" Full HD 1920 x 1080 165Hz 0.5ms DisplayPort HDMI DVI-D G-SYNC Compatible Asus Eye Care Flciker-Free Technology Low Blue Light Built-in Speakers Backlit LED Gaming Monitor",$249.00,Free Shipping,https://www.newegg.com/p/pl?d=1080p+monitor+27+inch&N=4814&page=1
,"<a class=""item-title"" href=""https://www.newegg.com/black-asus-tuf-gaming-vg279qm-27/p/N82E16824281037?Item=N82E16824281037&amp;Description=1080p monitor 27 inch&amp;cm_re=1080p_monitor 27 inch-_-24-281-037-_-Product"" title=""View Details"">ASUS TUF Gaming VG279QM 27"" Full HD 1920 x 1080 1 ms (GTG) 280Hz (Overclocking) 2 x HDMI, DisplayPort G-SYNC ELMB SYNC HDR Built-in Speakers LED Backlit IPS Gaming Monitor</a>","ASUS TUF Gaming VG279QM 27"" Full HD 1920 x 1080 1 ms (GTG) 280Hz (Overclocking) 2 x HDMI, DisplayPort G-SYNC ELMB SYNC HDR Built-in Speakers LED Backlit IPS Gaming Monitor",$399.00,Free Shipping,https://www.newegg.com/p/pl?d=1080p+monitor+27+inch&N=4814&page=1
,"<a class=""item-title"" href=""https://www.newegg.com/asus-va27ehe-27-full-hd/p/N82E16824281014?Item=N82E16824281014&amp;Description=1080p monitor 27 inch&amp;cm_re=1080p_monitor 27 inch-_-24-281-014-_-Product"" title=""View Details"">ASUS VA27EHE 27"" Full HD 1920 x 1080 75Hz 5ms VGA HDMI Adaptive-Sync Asus Eye Care Low Blue Light and Flicker-Free Frameless Design LED Backlit IPS Monitor</a>","ASUS VA27EHE 27"" Full HD 1920 x 1080 75Hz 5ms VGA HDMI Adaptive-Sync Asus Eye Care Low Blue Light and Flicker-Free Frameless Design LED Backlit IPS Monitor",$147.99,Free Shipping,https://www.newegg.com/p/pl?d=1080p+monitor+27+inch&N=4814&page=1
,"<a class=""item-title"" href=""https://www.newegg.com/p/N82E16824475043?Item=N82E16824475043&amp;Description=1080p monitor 27 inch&amp;cm_re=1080p_monitor 27 inch-_-24-475-043-_-Product"" title=""View Details"">MSI Optix G27C4 27"" Full HD 1920 x 1080 1ms (MPRT) 165 Hz HDMI, DisplayPort AMD FreeSync Curved Gaming Monitor</a>","MSI Optix G27C4 27"" Full HD 1920 x 1080 1ms (MPRT) 165 Hz HDMI, DisplayPort AMD FreeSync Curved Gaming Monitor",$229.99,Free Shipping,https://www.newegg.com/p/pl?d=1080p+monitor+27+inch&N=4814&page=1
,"<a class=""item-title"" href=""https://www.newegg.com/dark-gray-red-msi-optix-mag270vc2-27/p/N82E16824475069?Item=N82E16824475069&amp;Description=1080p monitor 27 inch&amp;cm_re=1080p_monitor 27 inch-_-24-475-069-_-Product"" title=""View Details"">MSI Optix MAG270VC2 27"" Full HD 1920 x 1080 1ms (MPRT) / 4ms (GTG) 165 Hz HDMI, DisplayPort FreeSync (AMD Adaptive Sync) Curved Gaming Monitor</a>","MSI Optix MAG270VC2 27"" Full HD 1920 x 1080 1ms (MPRT) / 4ms (GTG) 165 Hz HDMI, DisplayPort FreeSync (AMD Adaptive Sync) Curved Gaming Monitor",$249.99,Free Shipping,https://www.newegg.com/p/pl?d=1080p+monitor+27+inch&N=4814&page=1
,"<a class=""item-title"" href=""https://www.newegg.com/p/N82E16824475092?Item=N82E16824475092&amp;Description=1080p monitor 27 inch&amp;cm_re=1080p_monitor 27 inch-_-24-475-092-_-Product"" title=""View Details"">MSI Optix MAG271VCR 27"" Full HD 1920 x 1080 1ms (MPRT) / 4ms (GTG) 165 Hz 2 x HDMI, DisplayPort FreeSync Curved Gaming Monitor</a>","MSI Optix MAG271VCR 27"" Full HD 1920 x 1080 1ms (MPRT) / 4ms (GTG) 165 Hz 2 x HDMI, DisplayPort FreeSync Curved Gaming Monitor",$249.99,Free Shipping,https://www.newegg.com/p/pl?d=1080p+monitor+27+inch&N=4814&page=1
,"<a class=""item-title"" href=""https://www.newegg.com/p/N82E16824475045?Item=N82E16824475045&amp;Description=1080p monitor 27 inch&amp;cm_re=1080p_monitor 27 inch-_-24-475-045-_-Product"" title=""View Details"">MSI OPTIX MAG272CRX 27"" 1920 x 1080 1 ms 240 Hz HDMI, DisplayPort, USB-C AMD FreeSync Curved Gaming Monitor</a>","MSI OPTIX MAG272CRX 27"" 1920 x 1080 1 ms 240 Hz HDMI, DisplayPort, USB-C AMD FreeSync Curved Gaming Monitor",$349.99,Free Shipping,https://www.newegg.com/p/pl?d=1080p+monitor+27+inch&N=4814&page=1
,"<a class=""item-title"" href=""https://www.newegg.com/p/N82E16824475014?Item=9SIAMHYCE54412&amp;Description=1080p monitor 27 inch&amp;cm_re=1080p_monitor 27 inch-_-24-475-014-_-Product"" title=""View Details"">MSI Optix MPG27CQ 27"" Full HD RGB LED Non-Glare Super Narrow Bezel 1 ms 2560 x 1440 144Hz Refresh Rate Steel Series GameSense FreeSync Technology Curved Gaming Monitor</a>","MSI Optix MPG27CQ 27"" Full HD RGB LED Non-Glare Super Narrow Bezel 1 ms 2560 x 1440 144Hz Refresh Rate Steel Series GameSense FreeSync Technology Curved Gaming Monitor","$1,264.54",Free Shipping,https://www.newegg.com/p/pl?d=1080p+monitor+27+inch&N=4814&page=1
,"<a class=""item-title"" href=""https://www.newegg.com/black-msi-optix-mag273r-27/p/N82E16824475066?Item=N82E16824475066&amp;Description=1080p monitor 27 inch&amp;cm_re=1080p_monitor 27 inch-_-24-475-066-_-Product"" title=""View Details"">MSI Optix MAG273R 27"" Full HD 1920 x 1080 1 ms 144 Hz HDMI, DisplayPort, USB FreeSync (AMD Adaptive Sync) IPS Gaming Monitor</a>","MSI Optix MAG273R 27"" Full HD 1920 x 1080 1 ms 144 Hz HDMI, DisplayPort, USB FreeSync (AMD Adaptive Sync) IPS Gaming Monitor",$249.99,Free Shipping,https://www.newegg.com/p/pl?d=1080p+monitor+27+inch&N=4814&page=1
,"<a class=""item-title"" href=""https://www.newegg.com/samsung-c27f390fhn-27-full-hd/p/N82E16824022479?Item=9SIAFJ8A0R1270&amp;Description=1080p monitor 27 inch&amp;cm_re=1080p_monitor 27 inch-_-24-022-479-_-Product"" title=""View Details"">SAMSUNG 390 Series C27F390FHN 27"" Full HD 1920 x 1080 4ms VGA HDMI AMD FreeSync Mega Dynamic Contrast Ratio Flicker-Free LED Backlit Curved Monitor for Business</a>","SAMSUNG 390 Series C27F390FHN 27"" Full HD 1920 x 1080 4ms VGA HDMI AMD FreeSync Mega Dynamic Contrast Ratio Flicker-Free LED Backlit Curved Monitor for Business",$178.48,Free Shipping,https://www.newegg.com/p/pl?d=1080p+monitor+27+inch&N=4814&page=1
,"<a class=""item-title"" href=""https://www.newegg.com/asus-ve278q-27-full-hd/p/N82E16824236103?Item=N82E16824236103&amp;Description=1080p monitor 27 inch&amp;cm_re=1080p_monitor 27 inch-_-24-236-103-_-Product"" title=""View Details"">ASUS VE278Q 27"" Full HD 1920 x 1080 2ms HDMI VGA DisplayPort DVI-D Built-in Speakers HDMI LED Backlight LCD Monitor</a>","ASUS VE278Q 27"" Full HD 1920 x 1080 2ms HDMI VGA DisplayPort DVI-D Built-in Speakers HDMI LED Backlight LCD Monitor",$174.99,Free Shipping,https://www.newegg.com/p/pl?d=1080p+monitor+27+inch&N=4814&page=1
,"<a class=""item-title"" href=""https://www.newegg.com/p/N82E16824236942?Item=N82E16824236942&amp;Description=1080p monitor 27 inch&amp;cm_re=1080p_monitor 27 inch-_-24-236-942-_-Product"" title=""View Details"">ASUS VG279Q 27"" Full HD 1920 x 1080 1ms MPRT , 3ms(GTG) 144 Hz DVI, HDMI, DisplayPort FreeSync (AMD Adaptive Sync) Built-in Speakers Gaming Monitor, Full HD, IPS, 144Hz, Adaptive-Sync</a>","ASUS VG279Q 27"" Full HD 1920 x 1080 1ms MPRT , 3ms(GTG) 144 Hz DVI, HDMI, DisplayPort FreeSync (AMD Adaptive Sync) Built-in Speakers Gaming Monitor, Full HD, IPS, 144Hz, Adaptive-Sync",$289.99,Free Shipping,https://www.newegg.com/p/pl?d=1080p+monitor+27+inch&N=4814&page=1
,"<a class=""item-title"" href=""https://www.newegg.com/p/N82E16824475046?Item=N82E16824475046&amp;Description=1080p monitor 27 inch&amp;cm_re=1080p_monitor 27 inch-_-24-475-046-_-Product"" title=""View Details"">MSI OPTIX MAG272CR 27"" Full HD 1920 x 1080 1 ms 165 Hz HDMI, DisplayPort, USB-C AMD FreeSync Curved Gaming Monitor</a>","MSI OPTIX MAG272CR 27"" Full HD 1920 x 1080 1 ms 165 Hz HDMI, DisplayPort, USB-C AMD FreeSync Curved Gaming Monitor",$279.99,Free Shipping,https://www.newegg.com/p/pl?d=1080p+monitor+27+inch&N=4814&page=1
,"<a class=""item-title"" href=""https://www.newegg.com/black-acer-nitro-ed270-xbmiipx-um-he0aa-x01-27/p/N82E16824011367?Item=N82E16824011367&amp;Description=1080p monitor 27 inch&amp;cm_re=1080p_monitor 27 inch-_-24-011-367-_-Product"" title=""View Details"">Acer Nitro ED270 Xbmiipx UM.HE0AA.X01 27"" Full HD 1920 x 1080 1 ms VRB 240 Hz HDMI, DisplayPort Built-in Speakers Curved Gaming Monitor</a>","Acer Nitro ED270 Xbmiipx UM.HE0AA.X01 27"" Full HD 1920 x 1080 1 ms VRB 240 Hz HDMI, DisplayPort Built-in Speakers Curved Gaming Monitor",$299.99,$4.99 Shipping,https://www.newegg.com/p/pl?d=1080p+monitor+27+inch&N=4814&page=1
,"<a class=""item-title"" href=""https://www.newegg.com/asus-ve278h-27-full-hd/p/N82E16824236295?Item=9SIA2F83MX9571&amp;Description=1080p monitor 27 inch&amp;cm_re=1080p_monitor 27 inch-_-24-236-295-_-Product"" title=""View Details"">ASUS VE278H 27"" Full HD 1920 x 1080 2ms (GTG) VGA HDMI Asus Eye Care with Ultra Low-Blue Light &amp; Flicker-Free Built-in Speakers LED Backlight LCD Monitor</a>","ASUS VE278H 27"" Full HD 1920 x 1080 2ms (GTG) VGA HDMI Asus Eye Care with Ultra Low-Blue Light & Flicker-Free Built-in Speakers LED Backlight LCD Monitor",$164.42,Free Shipping,https://www.newegg.com/p/pl?d=1080p+monitor+27+inch&N=4814&page=1
,"<a class=""item-title"" href=""https://www.newegg.com/asus-vn279ql-27-full-hd/p/N82E16824236362?Item=N82E16824236362&amp;Description=1080p monitor 27 inch&amp;cm_re=1080p_monitor 27 inch-_-24-236-362-_-Product"" title=""View Details"">ASUS VN279QL 27"" Full HD 1920 x 1080 5ms (GTG) HDMI/MHL VGA DisplayPort Asus Eye Care with Ultra Low-Blue Light &amp; Flicker-Free Built-in Speakers LCD Monitor</a>","ASUS VN279QL 27"" Full HD 1920 x 1080 5ms (GTG) HDMI/MHL VGA DisplayPort Asus Eye Care with Ultra Low-Blue Light & Flicker-Free Built-in Speakers LCD Monitor",$209.99,Free Shipping,https://www.newegg.com/p/pl?d=1080p+monitor+27+inch&N=4814&page=1
,"<a class=""item-title"" href=""https://www.newegg.com/p/N82E16824475088?Item=N82E16824475088&amp;Description=1080p monitor 27 inch&amp;cm_re=1080p_monitor 27 inch-_-24-475-088-_-Product"" title=""View Details"">MSI Optix MAG274 27"" Full HD 1920 x 1080 1ms (MPRT) / 4ms (GTG) 144 Hz 2 x HDMI, DisplayPort, USB AMD FreeSync Gaming Monitor</a>","MSI Optix MAG274 27"" Full HD 1920 x 1080 1ms (MPRT) / 4ms (GTG) 144 Hz 2 x HDMI, DisplayPort, USB AMD FreeSync Gaming Monitor",$239.99,Free Shipping,https://www.newegg.com/p/pl?d=1080p+monitor+27+inch&N=4814&page=1
,"<a class=""item-title"" href=""https://www.newegg.com/samsung-s27e450d-27-full-hd/p/N82E16824022322?Item=9SIAFJ87MZ2009&amp;Description=1080p monitor 27 inch&amp;cm_re=1080p_monitor 27 inch-_-24-022-322-_-Product"" title=""View Details"">SAMSUNG SE450 Series S27E450D 27"" Full HD 1920 x 1080 5ms VGA DVI DisplayPort Flicker-Free Mega Dynamic Contrast Ratio LED Backlit LCD Monitor for Business</a>","SAMSUNG SE450 Series S27E450D 27"" Full HD 1920 x 1080 5ms VGA DVI DisplayPort Flicker-Free Mega Dynamic Contrast Ratio LED Backlit LCD Monitor for Business",$207.89,Free Shipping,https://www.newegg.com/p/pl?d=1080p+monitor+27+inch&N=4814&page=1
,"<a class=""item-title"" href=""https://www.newegg.com/black-acer-ed270r-pbiipx-um-he0aa-p01-27/p/N82E16824011364?Item=N82E16824011364&amp;Description=1080p monitor 27 inch&amp;cm_re=1080p_monitor 27 inch-_-24-011-364-_-Product"" title=""View Details"">Acer ED270R 27"" Black 1920 x 1080 Widescreen 16:9 165Hz Refresh Rate AMD FreeSync Premium Technology, 2x HDMI, DisplayPort Curved LED Gaming Monitor</a>","Acer ED270R 27"" Black 1920 x 1080 Widescreen 16:9 165Hz Refresh Rate AMD FreeSync Premium Technology, 2x HDMI, DisplayPort Curved LED Gaming Monitor",$209.99,Free Shipping,https://www.newegg.com/p/pl?d=1080p+monitor+27+inch&N=4814&page=1
,"<a class=""item-title"" href=""https://www.newegg.com/p/N82E16824475003?Item=N82E16824475003&amp;Description=1080p monitor 27 inch&amp;cm_re=1080p_monitor 27 inch-_-24-475-003-_-Product"" title=""View Details"">MSI Optix G27C2 27"" 1920 x 1080 1ms (MPRT) / 4ms (GTG) 144Hz DVI HDMI DisplayPort AMD FreeSync Widescreen Anti-Glare LED Backlight Curved Gaming Monitor</a>","MSI Optix G27C2 27"" 1920 x 1080 1ms (MPRT) / 4ms (GTG) 144Hz DVI HDMI DisplayPort AMD FreeSync Widescreen Anti-Glare LED Backlight Curved Gaming Monitor",$239.99,Free Shipping,https://www.newegg.com/p/pl?d=1080p+monitor+27+inch&N=4814&page=1
,"<a class=""item-title"" href=""https://www.newegg.com/black-acer-vg270-pbiip-um-hv0aa-p02-27/p/N82E16824011339?Item=N82E16824011339&amp;Description=1080p monitor 27 inch&amp;cm_re=1080p_monitor 27 inch-_-24-011-339-_-Product"" title=""View Details"">Acer Nitro VG270 Pbiip 27"" Full HD 1920 x 1080 1ms (VRB) 144Hz 2xHDMI DisplayPort AMD FreeSync Backlit LED IPS Gaming Monitor</a>","Acer Nitro VG270 Pbiip 27"" Full HD 1920 x 1080 1ms (VRB) 144Hz 2xHDMI DisplayPort AMD FreeSync Backlit LED IPS Gaming Monitor",$199.99,$4.99 Shipping,https://www.newegg.com/p/pl?d=1080p+monitor+27+inch&N=4814&page=1
SALE,"<a class=""item-title"" href=""https://www.newegg.com/acer-g276hl-kbmidx-27-full-hd/p/N82E16824011151?Item=N82E16824011151&amp;Description=1080p monitor 27 inch&amp;cm_re=1080p_monitor 27 inch-_-24-011-151-_-Product"" title=""View Details"">Acer G6 Series G276HL Kbmidx 27"" Full HD 1920 x 1080 5ms 60Hz DVI HDMI VGA Built-in Speakers Flicker-Free Acer ComfyView LED Backlit LCD Monitor</a>","Acer G6 Series G276HL Kbmidx 27"" Full HD 1920 x 1080 5ms 60Hz DVI HDMI VGA Built-in Speakers Flicker-Free Acer ComfyView LED Backlit LCD Monitor",$139.99,$4.99 Shipping,https://www.newegg.com/p/pl?d=1080p+monitor+27+inch&N=4814&page=1
,"<a class=""item-title"" href=""https://www.newegg.com/samsung-c27f398-27-full-hd/p/N82E16824022429?Item=N82E16824022429&amp;Description=1080p monitor 27 inch&amp;cm_re=1080p_monitor 27 inch-_-24-022-429-_-Product"" title=""View Details"">SAMSUNG 398 Series C27F398 27"" Full HD 1920 x 1080 4ms HDMI DisplayPort AMD FreeSync Flicker Free LED Backlit Curved Gaming Monitor</a>","SAMSUNG 398 Series C27F398 27"" Full HD 1920 x 1080 4ms HDMI DisplayPort AMD FreeSync Flicker Free LED Backlit Curved Gaming Monitor",$199.99,$4.99 Shipping,https://www.newegg.com/p/pl?d=1080p+monitor+27+inch&N=4814&page=1
,"<a class=""item-title"" href=""https://www.newegg.com/black-acer-predator-xb2-xb272-bmiprz-um-hx2aa-002-27/p/N82E16824011134?Item=9SIAJ8A8R40510&amp;Description=1080p monitor 27 inch&amp;cm_re=1080p_monitor 27 inch-_-9SIAJ8A8R40510-_-Product"" title=""View Details"">Acer Predator XB2 XB272 bmiprz Black 27"" 1ms 1920 x 1080 240 Hz, NVIDIA G-SYNC, Acer Flicker-less, 400 cd/m2 1,000:1, VESA Mountable, Height/Tilt/Swivel/Pivot Adjustable, USB 3.0, 2 x 2W Built-in Spea</a>","Acer Predator XB2 XB272 bmiprz Black 27"" 1ms 1920 x 1080 240 Hz, NVIDIA G-SYNC, Acer Flicker-less, 400 cd/m2 1,000:1, VESA Mountable, Height/Tilt/Swivel/Pivot Adjustable, USB 3.0, 2 x 2W Built-in Spea",$749.00,Free Shipping,https://www.newegg.com/p/pl?d=1080p+monitor+27+inch&N=4814&page=1
,"<a class=""item-title"" href=""https://www.newegg.com/p/N82E16824475082?Item=N82E16824475082&amp;Description=1080p monitor 27 inch&amp;cm_re=1080p_monitor 27 inch-_-24-475-082-_-Product"" title=""View Details"">MSI Optix MAG274R 27"" Full HD 1920 x 1080 1ms (MPRT) / 4ms (GTG) 144Hz IPS, HDMI, DisplayPort, USB AMD FreeSync Gaming Monitor</a>","MSI Optix MAG274R 27"" Full HD 1920 x 1080 1ms (MPRT) / 4ms (GTG) 144Hz IPS, HDMI, DisplayPort, USB AMD FreeSync Gaming Monitor",$279.99,Free Shipping,https://www.newegg.com/p/pl?d=1080p+monitor+27+inch&N=4814&page=1
,"<a class=""item-title"" href=""https://www.newegg.com/acer-27-full-hd/p/N82E16824011346?Item=9SIA2F8B9U4172&amp;Description=1080p monitor 27 inch&amp;cm_re=1080p_monitor 27 inch-_-24-011-346-_-Product"" title=""View Details"">Acer B277 27"" Full HD 1920 x 1080 75Hz 6ms (GTG) VGA HDMI DisplayPort AMD Adaptive SYNC Built-in Speakers LED Backlit IPS Monitor</a>","Acer B277 27"" Full HD 1920 x 1080 75Hz 6ms (GTG) VGA HDMI DisplayPort AMD Adaptive SYNC Built-in Speakers LED Backlit IPS Monitor",$186.47,Free Shipping,https://www.newegg.com/p/pl?d=1080p+monitor+27+inch&N=4814&page=1
,"<a class=""item-title"" href=""https://www.newegg.com/samsung-ls27f354fhnxza-27-full-hd/p/N82E16824022799?Item=N82E16824022799&amp;Description=1080p monitor 27 inch&amp;cm_re=1080p_monitor 27 inch-_-24-022-799-_-Product"" title=""View Details"">SAMSUNG S27F354 27"" 1920 x 1080 Full HD 4ms (GTG) 60Hz VGA HDMI AMD FreeSync Super Slim Design LED Backlit LCD Monitor</a>","SAMSUNG S27F354 27"" 1920 x 1080 Full HD 4ms (GTG) 60Hz VGA HDMI AMD FreeSync Super Slim Design LED Backlit LCD Monitor",$169.99,$4.99 Shipping,https://www.newegg.com/p/pl?d=1080p+monitor+27+inch&N=4814&page=1
,"<a class=""item-title"" href=""https://www.newegg.com/acer-um-hv7aa-001-27-full-hd/p/N82E16824011272?Item=9SIAMG8BKW6776&amp;Description=1080p monitor 27 inch&amp;cm_re=1080p_monitor 27 inch-_-24-011-272-_-Product"" title=""View Details"">Acer V277 27"" LED LCD Monitor - 16:9 - 4 ms GTG</a>","Acer V277 27"" LED LCD Monitor - 16:9 - 4 ms GTG",$189.99,$36.00 Shipping,https://www.newegg.com/p/pl?d=1080p+monitor+27+inch&N=4814&page=1
,"<a class=""item-title"" href=""https://www.newegg.com/p/1B4-001D-00HA8?Item=9SIA6ZPBMB7324&amp;Description=1080p monitor 27 inch&amp;cm_re=1080p_monitor 27 inch-_-1B4-001D-00HA8-_-Product"" title=""View Details"">27IN 1920X1080 IPS PANEL THIN BEZELS FULLY ADJ STAND VGAHDMIDPUSB HUB</a>",27IN 1920X1080 IPS PANEL THIN BEZELS FULLY ADJ STAND VGAHDMIDPUSB HUB,$262.99,Special Shipping,https://www.newegg.com/p/pl?d=1080p+monitor+27+inch&N=4814&page=1
,"<a class=""item-title"" href=""https://www.newegg.com/z-edge-u27c-27-hd-1080/p/0JC-00HU-00006?Item=9SIAT2ECNA9962&amp;Description=1080p monitor 27 inch&amp;cm_re=1080p_monitor 27 inch-_-0JC-00HU-00006-_-Product"" title=""View Details"">Z-EDGE U27C 27"" 1080P Full HD 1920x1080 LED Backlight Curved Screen Monitor, 5ms Respond Time, 75Hz Refresh rate, Built-in Speakers, 178° View Angle, HDMI+VGA</a>","Z-EDGE U27C 27"" 1080P Full HD 1920x1080 LED Backlight Curved Screen Monitor, 5ms Respond Time, 75Hz Refresh rate, Built-in Speakers, 178° View Angle, HDMI+VGA",$169.99,Free Shipping,https://www.newegg.com/p/pl?d=1080p+monitor+27+inch&N=4814&page=1
,"<a class=""item-title"" href=""https://www.newegg.com/v7-l27ads-2n-27-full-hd/p/N82E16824216069?Item=9SIAFJ88SS4979&amp;Description=1080p monitor 27 inch&amp;cm_re=1080p_monitor 27 inch-_-24-216-069-_-Product"" title=""View Details"">V7 L27ADS-2N 27"" Full HD 1920 x 1080 6ms VGA DVI HDMI Built-in Speakers Ultra Thin Bezel Backlit LED Matte Screen Monitor</a>","V7 L27ADS-2N 27"" Full HD 1920 x 1080 6ms VGA DVI HDMI Built-in Speakers Ultra Thin Bezel Backlit LED Matte Screen Monitor",$143.96,Free Shipping,https://www.newegg.com/p/pl?d=1080p+monitor+27+inch&N=4814&page=2
,"<a class=""item-title"" href=""https://www.newegg.com/vizta-v27cdh1-27-full-hd/p/N82E16824721011?Item=N82E16824721011&amp;Description=1080p monitor 27 inch&amp;cm_re=1080p_monitor 27 inch-_-24-721-011-_-Product"" title=""View Details"">Vizta V27CDH1 27"" Full HD 1920 x 1080 5ms 60Hz VGA HDMI Built-in Speakers Backlit LED LCD Monitor</a>","Vizta V27CDH1 27"" Full HD 1920 x 1080 5ms 60Hz VGA HDMI Built-in Speakers Backlit LED LCD Monitor",$129.99,$4.99 Shipping,https://www.newegg.com/p/pl?d=1080p+monitor+27+inch&N=4814&page=2
,"<a class=""item-title"" href=""https://www.newegg.com/viewsonic-vx2776-smhd-27-full-hd/p/N82E16824116818?Item=N82E16824116818&amp;Description=1080p monitor 27 inch&amp;cm_re=1080p_monitor 27 inch-_-24-116-818-_-Product"" title=""View Details"">ViewSonic VX2776-smhd 27"" Full HD 1920 x 1080 7ms (GTG W/OD) HDMI VGA DisplayPort Built-in Speakers Anti-Glare Backlit LED IPS Monitor</a>","ViewSonic VX2776-smhd 27"" Full HD 1920 x 1080 7ms (GTG W/OD) HDMI VGA DisplayPort Built-in Speakers Anti-Glare Backlit LED IPS Monitor",$169.99,Free Shipping,https://www.newegg.com/p/pl?d=1080p+monitor+27+inch&N=4814&page=2
